{
  "text_fields": [
    { "name": "body", "tokenizer": "default", "stored": true, "indexed": true }
  ],
  "keyword_fields": [
    { "name": "lang", "stored": true, "indexed": true, "fast": true }
  ],
  "numeric_fields": [
    { "name": "year", "i64": true, "fast": true }
  ],
  "vector_fields": []
}
